{"$schema":"https://json-schema.org/draft/2020-12/schema","$id":"aos.ecommerce-production-profile/v1","type":"object","additionalProperties":false,"required":["schema","moduleId","profileRevision","brief","evidenceSelection","eval","responsibility","contributionProjection"],"properties":{"schema":{"const":"aos.ecommerce-production-profile/v1"},"moduleId":{"type":"string","pattern":"^ecommerce[.][a-z0-9-]+$"},"profileRevision":{"type":"integer","minimum":1},"brief":{"$ref":"ecommerce-brief-spec.v1.schema.json"},"evidenceSelection":{"$ref":"ecommerce-evidence-selection.v1.schema.json"},"eval":{"$ref":"ecommerce-eval-profile.v1.schema.json"},"responsibility":{"$ref":"ecommerce-responsibility-template.v1.schema.json"},"contributionProjection":{"type":"object","additionalProperties":false,"required":["showAtomicSkillAttribution","showLogicRevision","showCoworkerBinding","showBlockers"],"properties":{"showAtomicSkillAttribution":{"const":true},"showLogicRevision":{"const":true},"showCoworkerBinding":{"const":true},"showBlockers":{"const":true}}}}}
