{"schema":"aos.ecommerce-production-profile/v1","moduleId":"ecommerce.creator-growth","profileRevision":1,"brief":{"mode":"owned","briefType":"creator-recruitment-negotiation","requiredFields":["objective","creatorCriteria","product","commercialTerms","deliveryStandard"],"sourceResponsibilityPreserved":true},"evidenceSelection":{"requiredFacts":["sourcePermission","creatorIdentity","matchEvidence","contactFrequency","contractRevision","deliveryEvidence"],"requireProvenance":true,"requireFreshness":true,"requireNegativeEvidence":true},"eval":{"gates":["identity","match","frequency","contract","outreachApproval"],"failClosed":true,"sameRevisionRequired":true},"responsibility":{"slots":[{"slotId":"creator.negotiation","responsibilityType":"maker","atomicSkillIds":["creator.match","creator.negotiate"],"protected":false,"mergeAllowed":true,"returnStage":"prepare"},{"slotId":"creator.compliance","responsibilityType":"independent_review","atomicSkillIds":["creator.compliance.review"],"protected":true,"mergeAllowed":false,"returnStage":"prepare"}],"handoffRequired":true,"reassignmentRequiresCanonicalDecision":true},"contributionProjection":{"showAtomicSkillAttribution":true,"showLogicRevision":true,"showCoworkerBinding":true,"showBlockers":true}}
