{"schema":"aos.ecommerce-production-profile/v1","moduleId":"ecommerce.price-governance","profileRevision":1,"brief":{"mode":"owned","briefType":"price-research-decision","requiredFields":["productScope","marketScope","observationWindow","pricingObjective","guardrails"],"sourceResponsibilityPreserved":true},"evidenceSelection":{"requiredFacts":["comparableEvidence","originalQuote","freshness","collectionPermission","pricePolicy","impactEstimate"],"requireProvenance":true,"requireFreshness":true,"requireNegativeEvidence":true},"eval":{"gates":["comparison","quoteIntegrity","freshness","permission","priceApproval"],"failClosed":true,"sameRevisionRequired":true},"responsibility":{"slots":[{"slotId":"price.strategy","responsibilityType":"maker","atomicSkillIds":["price.collect","price.match","strategy.plan"],"protected":false,"mergeAllowed":true,"returnStage":"prepare"},{"slotId":"price.review","responsibilityType":"independent_review","atomicSkillIds":["price.policy.review"],"protected":true,"mergeAllowed":false,"returnStage":"prepare"}],"handoffRequired":true,"reassignmentRequiresCanonicalDecision":true},"contributionProjection":{"showAtomicSkillAttribution":true,"showLogicRevision":true,"showCoworkerBinding":true,"showBlockers":true}}
